<!ELEMENT modulos (modulo*)>
<!ELEMENT modulo (nombre, contenidos)>
<!ELEMENT contenidos (unidaddidactica*)>
<!ELEMENT unidaddidactica (tipo, descripcion)>
    <!ATTLIST unidaddidactica numero CDATA #REQUIRED>
<!ELEMENT nombre (#PCDATA)>
<!ELEMENT tipo (#PCDATA)>
<!ELEMENT descripcion (#PCDATA)>